{
  "$schema": "http://json-schema.org/draft-07/schema#",
  "$id": "https://embeddedos.org/schemas/engineering-model/v1/design-annotations.schema.json",
  "title": "eCAD Design Annotations v1",
  "description": "Design intent a STEP file does not carry: which CAD part is which component, material assignment, joints and their limits, and components that exist in the design but not in the CAD. Every value states its source.",
  "type": "object",
  "additionalProperties": false,
  "required": [
    "$schema",
    "annotations_version",
    "design_id",
    "materials",
    "parts",
    "joints",
    "attachments",
    "components_without_cad",
    "relationships"
  ],
  "properties": {
    "$schema": {
      "const": "https://embeddedos.org/schemas/engineering-model/v1/design-annotations.schema.json"
    },
    "annotations_version": {
      "description": "The format version. Every minor version of v1 is accepted; annotations that use circuit_elements declare 1.1.0, which introduced it, and annotations that give a component without CAD a digital facet declare 1.2.0.",
      "enum": [
        "1.0.0",
        "1.1.0",
        "1.2.0"
      ]
    },
    "design_id": {
      "$ref": "common.schema.json#/definitions/identifier"
    },
    "materials": {
      "description": "Keyed by material id. Empty for a sample whose artefacts carry no geometry.",
      "type": "object",
      "propertyNames": {
        "pattern": "^[a-z][a-z0-9_]*$"
      },
      "additionalProperties": {
        "type": "object",
        "additionalProperties": false,
        "required": [
          "name",
          "density"
        ],
        "properties": {
          "name": {
            "$ref": "common.schema.json#/definitions/nonEmptyString"
          },
          "density": {
            "$ref": "common.schema.json#/definitions/quantity"
          }
        }
      }
    },
    "parts": {
      "description": "Keyed by the CAD part name exactly as the STEP file names it. Empty for a sample with no CAD; a CAD part left unannotated has no material, so its mass is UNKNOWN and what rests on it is BLOCKED.",
      "type": "object",
      "additionalProperties": {
        "type": "object",
        "additionalProperties": false,
        "required": [
          "component_id",
          "kind",
          "material"
        ],
        "properties": {
          "component_id": {
            "$ref": "common.schema.json#/definitions/identifier"
          },
          "kind": {
            "enum": [
              "structure",
              "shaft",
              "payload",
              "bearing",
              "fastener",
              "housing",
              "other"
            ]
          },
          "material": {
            "type": "string",
            "pattern": "^[a-z][a-z0-9_]*$"
          }
        }
      }
    },
    "joints": {
      "type": "array",
      "items": {
        "type": "object",
        "additionalProperties": false,
        "required": [
          "joint_id",
          "type",
          "parent",
          "child",
          "realized_by",
          "axis_sense",
          "limits"
        ],
        "properties": {
          "joint_id": {
            "$ref": "common.schema.json#/definitions/identifier"
          },
          "type": {
            "enum": [
              "revolute"
            ]
          },
          "parent": {
            "$ref": "common.schema.json#/definitions/identifier"
          },
          "child": {
            "$ref": "common.schema.json#/definitions/identifier"
          },
          "realized_by": {
            "description": "The component whose cylindrical faces define the joint axis. The axis is extracted from CAD geometry, never typed in.",
            "$ref": "common.schema.json#/definitions/identifier"
          },
          "axis_sense": {
            "description": "Assembly-frame vector the joint's positive rotation axis points along. The CAD fixes the axis line; this fixes the sense of a positive angle. Must lie within 60 degrees of the CAD axis or the axis is UNKNOWN.",
            "type": "array",
            "minItems": 3,
            "maxItems": 3,
            "items": {
              "type": "number"
            }
          },
          "limits": {
            "type": "object",
            "additionalProperties": false,
            "required": [
              "lower",
              "upper"
            ],
            "properties": {
              "lower": {
                "$ref": "common.schema.json#/definitions/quantity"
              },
              "upper": {
                "$ref": "common.schema.json#/definitions/quantity"
              }
            }
          }
        }
      }
    },
    "attachments": {
      "description": "Rigid attachments: component is fixed to attached_to. Determines which body a part moves with.",
      "type": "array",
      "items": {
        "type": "object",
        "additionalProperties": false,
        "required": [
          "component",
          "attached_to"
        ],
        "properties": {
          "component": {
            "$ref": "common.schema.json#/definitions/identifier"
          },
          "attached_to": {
            "$ref": "common.schema.json#/definitions/identifier"
          }
        }
      }
    },
    "components_without_cad": {
      "type": "array",
      "items": {
        "type": "object",
        "additionalProperties": false,
        "required": [
          "component_id",
          "name",
          "kind",
          "domains"
        ],
        "properties": {
          "component_id": {
            "$ref": "common.schema.json#/definitions/identifier"
          },
          "name": {
            "$ref": "common.schema.json#/definitions/nonEmptyString"
          },
          "kind": {
            "enum": [
              "motor",
              "gearbox",
              "motor_driver",
              "battery",
              "sensor",
              "controller",
              "pcb",
              "other"
            ]
          },
          "domains": {
            "type": "object",
            "additionalProperties": false,
            "properties": {
              "mechanical": {
                "$ref": "#/definitions/facet"
              },
              "electrical": {
                "$ref": "#/definitions/facet"
              },
              "digital": {
                "description": "Format 1.2.0.",
                "$ref": "#/definitions/facet"
              },
              "control": {
                "$ref": "#/definitions/facet"
              },
              "thermal": {
                "$ref": "#/definitions/facet"
              }
            }
          }
        }
      }
    },
    "circuit_elements": {
      "description": "Keyed by the designator of a netlist element: its name, its kind and the ratings of the part it stands for (format 1.1.0). Never a value the netlist states: a facet the netlist sets is refused as declared twice.",
      "type": "object",
      "propertyNames": {
        "pattern": "^[RCVIS][A-Z0-9_]{1,31}$"
      },
      "additionalProperties": {
        "type": "object",
        "additionalProperties": false,
        "required": [
          "name",
          "kind"
        ],
        "properties": {
          "name": {
            "$ref": "common.schema.json#/definitions/nonEmptyString"
          },
          "kind": {
            "enum": [
              "fuse",
              "resistor",
              "capacitor",
              "switch",
              "voltage_source",
              "current_source",
              "other"
            ]
          },
          "note": {
            "$ref": "common.schema.json#/definitions/nonEmptyString"
          },
          "domains": {
            "type": "object",
            "additionalProperties": false,
            "properties": {
              "electrical": {
                "$ref": "#/definitions/facet"
              },
              "thermal": {
                "$ref": "#/definitions/facet"
              }
            }
          }
        }
      }
    },
    "relationships": {
      "type": "array",
      "items": {
        "type": "object",
        "additionalProperties": false,
        "required": [
          "relation",
          "from",
          "to"
        ],
        "properties": {
          "relation": {
            "enum": [
              "mounted_to",
              "connected_to",
              "drives",
              "powered_by",
              "controls",
              "senses",
              "constrained_by",
              "thermally_connected_to"
            ]
          },
          "from": {
            "$ref": "common.schema.json#/definitions/identifier"
          },
          "to": {
            "$ref": "common.schema.json#/definitions/identifier"
          }
        }
      }
    }
  },
  "allOf": [
    {
      "description": "circuit_elements is an addition of format 1.1.0.",
      "if": {
        "required": [
          "circuit_elements"
        ]
      },
      "then": {
        "properties": {
          "annotations_version": {
            "const": "1.1.0"
          }
        }
      }
    },
    {
      "description": "A digital facet on a component without CAD is an addition of format 1.2.0.",
      "if": {
        "required": [
          "components_without_cad"
        ],
        "properties": {
          "components_without_cad": {
            "contains": {
              "required": [
                "domains"
              ],
              "properties": {
                "domains": {
                  "required": [
                    "digital"
                  ]
                }
              }
            }
          }
        }
      },
      "then": {
        "properties": {
          "annotations_version": {
            "const": "1.2.0"
          }
        }
      }
    }
  ],
  "definitions": {
    "facet": {
      "type": "object",
      "propertyNames": {
        "pattern": "^[a-z][a-z0-9_]*$"
      },
      "additionalProperties": {
        "$ref": "common.schema.json#/definitions/quantity"
      }
    }
  }
}
