{
  "$schema": "https://embeddedos.org/schemas/engineering-model/v1/design-annotations.schema.json",
  "annotations_version": "1.2.0",
  "design_id": "uart_loopback_001",
  "materials": {},
  "parts": {},
  "joints": [],
  "attachments": [],
  "components_without_cad": [
    {
      "component_id": "target_device",
      "name": "the FPGA or ASIC this RTL would be implemented on (none is selected)",
      "kind": "other",
      "domains": {
        "digital": {
          "min_clock_period": {
            "value": null,
            "unit": "s",
            "status": "UNKNOWN",
            "source": {
              "kind": "design_annotation",
              "ref": "datasets/cad/uart_loopback_001/design/annotations.json"
            },
            "note": "no target device is selected and the design has not been synthesised, so the shortest clock period it would meet is unknown"
          }
        }
      }
    }
  ],
  "relationships": [
    {
      "relation": "constrained_by",
      "from": "tb_uart_loopback",
      "to": "target_device"
    }
  ]
}
